{
  "ai_model": "ThreeC 1.1 Phase 1.4 · 第二轮：改用东方财富 EOD 序列计算（T2），修正首轮的媒体证据误判",
  "contract": "market_regime_draft",
  "evidence": [
    {
      "claim": "沪深300 于 2026-09-01 收 4611.44，2026-09-30 收 4357.62，近 20 交易日区间下跌 5.50%，落入 DOWN 档（≤ -5%）。",
      "dimension": "broad_index_state",
      "evidence_id": "MR-EV-01",
      "metric": "沪深300（1.000300）近 20 交易日区间涨跌 —— **按规则主标的计算**",
      "source_date": "2026-09-30",
      "source_tier": "T2",
      "source_title": "东方财富 EOD 日线（沪深300，klt=101，前复权）",
      "value_text": "4357.62 / 4611.44 − 1 = **-5.50%**",
      "window": "2026-09-01 ~ 2026-09-30（20 个交易日）"
    },
    {
      "claim": "同期上证综指跌幅明显小于沪深300，说明**换用不同宽基会得出不同档位** —— 这正是规则要求以沪深300 为主标的的原因。",
      "dimension": "broad_index_state",
      "evidence_id": "MR-EV-02",
      "metric": "上证综指同期区间（口径差异对照）",
      "source_date": "2026-09-30",
      "source_tier": "T2",
      "source_title": "东方财富 EOD 日线（上证综指 1.000001）",
      "value_text": "3842.19 / 3979.89 − 1 ≈ **-3.5%**（全月 -3.62%）",
      "window": "2026-09-01 ~ 2026-09-30"
    },
    {
      "claim": "两市日均成交额较窗口均值低 11.0%，未达 CONTRACTING 门槛（≤ -15%），按规则记为 STABLE。",
      "dimension": "liquidity_state",
      "evidence_id": "MR-EV-03",
      "metric": "两市日均成交额（上证综指 + 深证综指）近 20 交易日 vs 全窗口均值",
      "source_date": "2026-09-30",
      "source_tier": "T2",
      "source_title": "东方财富 EOD 日线（1.000001 + 0.399106 成交额求和）",
      "value_text": "近20日均值 **18039 亿** · 窗口(42日)均值 20269 亿 → **-11.0%**",
      "window": "2026-08-03 ~ 2026-09-30（42 个交易日；★ 不足规则要求的 60 日）"
    },
    {
      "claim": "单日成交额创近 14 个月新低，但**单日极值不等于均值口径**：规则用 20 日 vs 60 日均值比，故本维度记为 STABLE 而非 CONTRACTING。",
      "dimension": "liquidity_state",
      "evidence_id": "MR-EV-04",
      "metric": "单日地量（与均值口径的差异）",
      "source_date": "2026-09-29",
      "source_tier": "T2",
      "source_title": "东方财富 EOD（同日两市成交额）· 财联社 2026-09-29",
      "value_text": "09-29 两市成交额 **14091.97 亿**，创 2025-07-08 以来新低",
      "window": "2026-09-29"
    },
    {
      "claim": "可得日度样本的上涨家数占比均值约 54%，落在 NORMAL 区间（40%–60%）。",
      "dimension": "breadth_state",
      "evidence_id": "MR-EV-05",
      "metric": "全市场上涨/下跌家数（可得交易日样本）",
      "source_date": "2026-09-30",
      "source_tier": "T3",
      "source_title": "FactorHub 每日市场摘要 2026-09-30 · 每经 2026-09-29 · 股票复盘 2026-09-04/09-07",
      "value_text": "09-30：上涨 2567 / 下跌 2824；09-29：超 3400 只上涨；09-07：3040 涨 / 1987 跌；09-04：2249 涨 → 占比 45%–64%，均值≈54%",
      "window": "2026-09-04 / 09-07 / 09-29 / 09-30（4 个交易日样本；★ 不足规则要求的「近 4 周周均」）"
    },
    {
      "claim": "资金向低 β 防御方向（银行）集中，高 β 成长方向大幅调整 —— 该信号指向风险偏好收缩。",
      "dimension": "risk_appetite_state",
      "evidence_id": "MR-EV-06",
      "metric": "低 β 权重（银行）与高 β 成长（创业板/科创）相对表现",
      "source_date": "2026-09-30",
      "source_tier": "T3",
      "source_title": "新浪财经/格隆汇 2026-09-30",
      "value_text": "工行、建行、中行等多只银行股本月创历史新高；同期创业板指跌超 8%、科创50 跌超 9%",
      "window": "2026-09 全月"
    },
    {
      "claim": "同期部分题材方向大幅上涨，投机活跃度未同步收缩 —— 与 MR-EV-06 方向相反，故按规则「信号冲突 → NEUTRAL」。",
      "dimension": "risk_appetite_state",
      "evidence_id": "MR-EV-07",
      "metric": "题材/投机方向表现（与低 β 信号相反）",
      "source_date": "2026-09-30",
      "source_tier": "T3",
      "source_title": "新浪财经/格隆汇 2026-09-30",
      "value_text": "CRO 近岸蛋白涨超 133%；PCB 澳弘电子涨超 88%；黄酒会稽山涨近 93%；有色金属领跌（贵金属、锂矿个股跌超 20%）",
      "window": "2026-09 全月"
    },
    {
      "claim": "★ 首轮用「规则允许的次要标的」上证综指替代缺失的主标的沪深300，得出 FLAT；改用 T2 序列后为 DOWN。**记录此偏差以证明：媒体事实 ≠ 可计算序列，替代标的不应作为定档依据。**",
      "dimension": "broad_index_state",
      "evidence_id": "MR-EV-08",
      "metric": "首轮媒体证据的偏差（留痕，供审核对照）",
      "source_date": "2026-09-30",
      "source_tier": "T3",
      "source_title": "首轮：新浪财经/格隆汇 2026-09-30（已由 T2 序列修正）",
      "value_text": "首轮基于上证综指 -3.62% 判为 FLAT；真实主标的（沪深300）为 -5.50% → DOWN",
      "window": "2026-09 全月"
    }
  ],
  "generated_at": "2026-10-06T21:40:00+08:00",
  "generated_by": "ai-offline",
  "market_regime": {
    "beta_note": "2026-09 A 股「指数温和下跌 + 结构剧烈分化」：沪深300 近 20 交易日 **-5.50%**（已破 -5% 档），但上证综指同期仅 -3.6% 左右，而创业板/科创跌幅更大。★ β 不可分离程度**高**：不同宽基方向一致但幅度差异极大，跨标的比较必须以同一区间口径为准，**不得用单一指数代表全市场**。",
    "breadth_state": "NORMAL",
    "broad_index_state": "DOWN",
    "evidence_refs": [
      "MR-EV-01",
      "MR-EV-02",
      "MR-EV-03",
      "MR-EV-04",
      "MR-EV-05",
      "MR-EV-06",
      "MR-EV-07",
      "MR-EV-08"
    ],
    "liquidity_state": "STABLE",
    "risk_appetite_state": "NEUTRAL"
  },
  "market_regime_version": "0.1",
  "review": {
    "decided_at": null,
    "rationale": null,
    "reviewer": null,
    "status": "PENDING"
  },
  "snapshot_date": "2026-10-06",
  "unknown_notes": {}
}
